userScreenName,userName,date,text,comments,likes,retweets,tweetURL,score
Francis@totobobo,Francis@totobobo,2023-01-12T10:51:49.000Z, Must said I'm impressed by the AI's suggestion. Scary sensible! chatgpt #CyclingInSingapore #LovecyclingSG @tehsiewdai  @Toto_B2W  @aldrinpelicano  @PaulABarter,0,4,8,https://twitter.com/totobobo/status/1613488918045028353,0
Rudrank,@rudrankriyam,2023-01-14T01:03:23.000Z," When  @twannl  gets to know that I copied code from chatgpt instead of his blog: 1,102",0,0,17,https://twitter.com/rudrankriyam/status/1614065606386679809,0
Eugene Santos,@eugenesergio,2023-01-13T02:19:34.000Z," While chatgpt is trending, I tend to go back to uncle’s advice. Noah Kagan @noahkagan · Jan 12 The best marketing strategy is to build a great product.",0,0,0,https://twitter.com/eugenesergio/status/1613722390739169280,-1
Eugene Santos,@eugenesergio,2023-01-13T03:33:07.000Z," chatgpt GIF ALT Roy van Rijn @royvanrijn · Jan 13 Today ChatGPT turned a flat JSON object into 12 tables incl relations and 10 type enums, turned that entire DDL into JPA entities; and made all the CRUD Spring Boot endpoints, in a couple of hours. That could also have been a week of typing…",0,0,0,https://twitter.com/eugenesergio/status/1613740900009803776,0
Ranajit Dam,@ranajitdam,2023-01-11T13:24:21.000Z," Can #chatgpt play quizmaster? The answer is sure! Although the questions need some refining. Here's two rounds - on Hollywood blockbusters, and rock music 1960s-1990s",1,0,2,https://twitter.com/ranajitdam/status/1613164913060642818,0
Lup Yuen Lee 李立源,@MisterTechBlog,2023-01-11T07:04:09.000Z, Australian Universities to return to ‘pen and paper’ exams after students caught using AI to write essays chatgpt theguardian.com Australian universities to return to ‘pen and paper’ exams after students caught using AI to write... Australia’s leading universities say redesign of how students are assessed is ‘critical’ in the face of a revolution in computer-generated text,0,2,1,https://twitter.com/MisterTechBlog/status/1613069233046564864,0
